{
  "schemaVersion": "1.0.0",
  "meta": {
    "owners": [
      "product",
      "engineering"
    ],
    "sourceDocuments": [
      "examples/task/system.promise.md"
    ],
    "title": "Task Promise Spec",
    "domain": "task",
    "version": "v1",
    "status": "active",
    "summary": "Canonical System Promise for the Task example."
  },
  "intentPromises": [
    {
      "name": "TaskSystemIntent",
      "priority": "must",
      "status": "active",
      "root": true,
      "statement": "The task system must keep task lifecycle truth explicit, simple, and verifiable.",
      "rationale": "This system-level intent anchors the human purpose behind the Task Promise graph.",
      "sources": [
        "human prompt 2026-05-14"
      ],
      "parents": [],
      "maps": [
        {
          "target": "TaskFieldPromise",
          "relation": "constrains",
          "note": "Field truth is governed by the system-level intent."
        },
        {
          "target": "CreateTaskFunctionPromise",
          "relation": "motivates",
          "note": "Creation behavior is part of the system-level intent."
        },
        {
          "target": "CompleteTaskFunctionPromise",
          "relation": "motivates",
          "note": "Completion behavior is part of the system-level intent."
        },
        {
          "target": "TaskFieldInvariantVerification",
          "relation": "verifies",
          "note": "Field invariants prove the system-level intent."
        }
      ]
    },
    {
      "name": "PreserveTaskLifecycleTruth",
      "priority": "must",
      "status": "active",
      "root": false,
      "statement": "A task's completion state must be explicit, reversible, and not duplicated through hidden flags.",
      "rationale": "Human intent should remain visible even after it is lowered into state fields, invariants, behaviors, and verification scenarios.",
      "sources": [
        "human prompt 2026-05-14"
      ],
      "parents": [
        {
          "target": "TaskSystemIntent",
          "relation": "refines",
          "note": "Lifecycle truth is one branch of the system-level task intent."
        }
      ],
      "maps": [
        {
          "target": "Task.status",
          "relation": "constrains",
          "note": "Task.status is the single business-state carrier."
        },
        {
          "target": "Task.done",
          "relation": "constrains",
          "note": "The done state remains explicit and reversible."
        },
        {
          "target": "Task.done_requires_completedAt",
          "relation": "constrains",
          "note": "Completion truth requires a timestamp."
        },
        {
          "target": "Task.no_duplicate_completion_flag",
          "relation": "constrains",
          "note": "Hidden duplicate completion flags are forbidden."
        },
        {
          "target": "CompleteTaskFunctionPromise",
          "relation": "motivates",
          "note": "Completion behavior exists to fulfill lifecycle intent."
        },
        {
          "target": "TaskTransitionRejectionVerification",
          "relation": "verifies",
          "note": "Invalid transitions must be proved, not assumed."
        }
      ]
    },
    {
      "name": "KeepTaskCreationSimple",
      "priority": "should",
      "status": "active",
      "root": false,
      "statement": "Creating a task should require only human-readable content and should start in todo state.",
      "rationale": "The create path should not ask callers to provide lifecycle state that the system can derive from the Promise.",
      "sources": [
        "human prompt 2026-05-14"
      ],
      "parents": [
        {
          "target": "TaskSystemIntent",
          "relation": "refines",
          "note": "Creation simplicity is one branch of the system-level task intent."
        }
      ],
      "maps": [
        {
          "target": "Task.title",
          "relation": "constrains",
          "note": "Title is the human-authored creation input."
        },
        {
          "target": "CreateTaskFunctionPromise",
          "relation": "motivates",
          "note": "CreateTask owns initial task creation."
        },
        {
          "target": "CreateTask.initializes_todo_task",
          "relation": "constrains",
          "note": "A new task starts as todo with no completion timestamp."
        },
        {
          "target": "TaskFieldInvariantVerification",
          "relation": "verifies",
          "note": "Creation output must be covered by field invariant verification."
        }
      ]
    }
  ],
  "typePromises": [
    {
      "name": "TaskID",
      "kind": "id",
      "base": "string",
      "summary": "Stable identity for a task.",
      "format": "opaque",
      "generated": true
    }
  ],
  "fieldPromises": [
    {
      "name": "TaskFieldPromise",
      "object": "Task",
      "summary": "Defines the Task object, its fields, valid states, and invariants.",
      "fields": [
        {
          "name": "id",
          "type": "TaskID",
          "required": true,
          "nullable": false,
          "default": null,
          "semantic": "Unique identifier for a task.",
          "mutable": false,
          "systemManaged": true,
          "readers": [
            "*"
          ],
          "writers": [
            "system.create"
          ]
        },
        {
          "name": "title",
          "type": "string",
          "required": true,
          "nullable": false,
          "default": null,
          "semantic": "Human-readable task content and must not be empty.",
          "mutable": true,
          "systemManaged": false,
          "readers": [
            "*"
          ],
          "writers": [
            "user.create",
            "user.edit"
          ]
        },
        {
          "name": "status",
          "type": "enum(todo|done)",
          "required": true,
          "nullable": false,
          "default": "todo",
          "semantic": "Business state of the task.",
          "mutable": true,
          "systemManaged": false,
          "readers": [
            "*"
          ],
          "writers": [
            "system.completeTask",
            "system.reopenTask"
          ]
        },
        {
          "name": "completedAt",
          "type": "datetime",
          "required": false,
          "nullable": true,
          "default": null,
          "semantic": "Completion timestamp and only valid when status is done.",
          "mutable": true,
          "systemManaged": false,
          "readers": [
            "*"
          ],
          "writers": [
            "system.completeTask",
            "system.reopenTask"
          ]
        },
        {
          "name": "createdAt",
          "type": "datetime",
          "required": true,
          "nullable": false,
          "default": "system-generated",
          "semantic": "Creation timestamp and immutable after creation.",
          "mutable": false,
          "systemManaged": true,
          "readers": [
            "*"
          ],
          "writers": [
            "system.create"
          ]
        },
        {
          "name": "updatedAt",
          "type": "datetime",
          "required": true,
          "nullable": false,
          "default": "system-generated",
          "semantic": "Timestamp refreshed on every valid state or field mutation.",
          "mutable": true,
          "systemManaged": true,
          "readers": [
            "*"
          ],
          "writers": [
            "system.maintain"
          ]
        }
      ],
      "states": [
        {
          "value": "todo",
          "meaning": "Task is not yet complete.",
          "terminal": false,
          "transitions": [
            "done"
          ],
          "initial": true
        },
        {
          "value": "done",
          "meaning": "Task has been completed.",
          "terminal": false,
          "transitions": [
            "todo"
          ],
          "initial": false
        }
      ],
      "invariants": [
        {
          "id": "Task.done_requires_completedAt",
          "statement": "When Task.status is done, Task.completedAt must exist.",
          "refs": [
            "Task.status",
            "Task.completedAt"
          ],
          "when": "Task.status = done",
          "must": "Task.completedAt != null"
        },
        {
          "id": "Task.todo_requires_null_completedAt",
          "statement": "When Task.status is todo, Task.completedAt must be null.",
          "refs": [
            "Task.status",
            "Task.completedAt"
          ],
          "when": "Task.status = todo",
          "must": "Task.completedAt = null"
        },
        {
          "id": "Task.createdAt_immutable",
          "statement": "Task.createdAt cannot be changed by business actions.",
          "refs": [
            "Task.createdAt"
          ],
          "must": "Task.createdAt is immutable after creation"
        }
      ],
      "globalConstraints": [
        {
          "id": "Task.single_business_state",
          "statement": "A Task can only be in one business state at a time.",
          "refs": [
            "Task.status"
          ]
        },
        {
          "id": "Task.state_transitions_preserve_invariants",
          "statement": "Every legal state transition must preserve field invariants.",
          "refs": [
            "Task.status",
            "Task.completedAt"
          ]
        }
      ],
      "forbiddenImplicitState": [
        {
          "id": "Task.no_duplicate_completion_flag",
          "statement": "Do not introduce isCompleted or any duplicate completion flag outside declared fields.",
          "refs": [
            "Task.status",
            "Task.completedAt"
          ]
        },
        {
          "id": "Task.no_hidden_ui_state_as_business_truth",